{
  "tenant_id": "tenant-acme",
  "correlation_id": "corr-ai-posture-0001",
  "target": {
    "server_id": "server-acme-01",
    "deployment_id": "deployment-acme-hermes-01"
  },
  "authority": "omes-host",
  "evidence_freshness": "fresh",
  "classification_mode": "fail_closed_v1",
  "destination_class": "local",
  "local_endpoint_classification": "loopback",
  "status": "PASS",
  "reason_codes": ["AI_PRIVACY_POSTURE_PASS_CONSISTENT"],
  "last_verified_at": "2026-09-24T11:55:00Z",
  "projected_at": "2026-09-24T12:00:00Z",
  "latest_decision": null
}
